{
  "version": 1,
  "readyLabel": "ready-for-agent",
  "branchPrefix": "codex/issue-",
  "ciTimeoutMinutes": 60,
  "localChecks": [
    {
      "name": "test",
      "command": "your-test-command",
      "arguments": []
    }
  ],
  "requiredChecks": ["test"],
  "primaryAgent": {
    "provider": "codex",
    "model": ""
  },
  "metadataAgent": {
    "provider": "deterministic",
    "model": "",
    "fallback": true
  }
}
